{
    "$schema": "../schemas/event.schema.json",

    "slug": "jbpl-2026-fe-1-q3",
    "name": "JB Pro League 2026 Female #1 Qualifier 3",
    "duration": { "start": "2026-01-31", "end": "2026-02-01" },
    "urls": {
        "Officail Website": "https://jbproleague.com/news/11b110d1-1125-483a-b5bd-bcbd115afac4",
        "Bracket": "https://www.challengermode.com/s/JBProLeague/tournaments/acd3cf54-edac-4040-1877-08de40692357"
    },
    "participants": { "lhc": "let-her-cook-2026-2" },
    "matches": [
        {
            "slug": "match17",
            "bracket": ["Round of 16", "Match 1"],
            "date": "2026-01-31",
            "matchup": { "team1": "confidence", "team2": "lhc" },
            "maps": [
                { "slug": "map1", "map": "nuke", "result": "13:9", "url": "https://www.challengermode.com/s/JBProLeague/games/2d619f8e-30d2-4858-3e5d-08de5760407d" },
                { "slug": "map2", "map": "mrg", "result": "10:13", "url": "https://www.challengermode.com/s/JBProLeague/games/7175a05f-eedb-42c4-3f85-08de5760407d" },
                { "slug": "map3", "map": "d2", "result": "13:16", "url": "https://www.challengermode.com/s/JBProLeague/games/c4c54fc4-2437-436d-40ca-08de5760407d" }
            ],
            "note": "ANa stood in for GooseBreeder."
        },
        {
            "slug": "match25",
            "bracket": ["Quarter finals", "Match 1"],
            "date": "2026-02-01",
            "matchup": { "team1": "lhc", "team2": "imodium" },
            "maps": [
                {
                    "slug": "map1",
                    "map": "mrg",
                    "result": "13:9",
                    "url": "https://www.challengermode.com/s/JBProLeague/games/81ce05d4-8760-46c7-5178-08de60ebcb60",
                    "streams": [{ "caster": "Affinity", "language": "en", "tags": ["official"], "parts": [{ "url": "https://www.twitch.tv/videos/2686043957", "name": "VOD", "duration": "00:27:18-01:30:49" }] }]
                },
                {
                    "slug": "map2",
                    "map": "anc",
                    "result": "6:13",
                    "url": "https://www.challengermode.com/s/JBProLeague/games/06d931df-c556-416a-f0dc-08de6174dbff",
                    "streams": [{ "caster": "Affinity", "language": "en", "tags": ["official"], "parts": [{ "url": "https://www.twitch.tv/videos/2686043957", "name": "VOD", "duration": "01:44:08-02:19:48" }] }]
                },
                {
                    "slug": "map3",
                    "map": "anb",
                    "result": "13:3",
                    "url": "https://www.challengermode.com/s/JBProLeague/games/0cfe618d-21c1-4ab3-f16c-08de6174dbff",
                    "streams": [
                        {
                            "caster": "Affinity",
                            "language": "en",
                            "tags": ["official"],
                            "parts": [
                                { "url": "https://www.twitch.tv/videos/2686043957", "name": "Part 1", "duration": "02:30:53-02:52:13" },
                                { "url": "https://www.twitch.tv/videos/2686043957", "name": "Part 2", "duration": "03:12:38-03:39:29" }
                            ]
                        }
                    ]
                }
            ]
        },
        {
            "slug": "match29",
            "bracket": ["Semi finals", "Match 1"],
            "date": "2026-02-01",
            "matchup": { "team1": "lhc", "team2": "FUTURE W" },
            "maps": [
                {
                    "slug": "map1",
                    "map": "d2",
                    "result": "13:8",
                    "url": "https://www.challengermode.com/s/JBProLeague/games/21e0df3f-0cab-4069-f26b-08de6174dbff",
                    "streams": [{ "caster": "Affinity", "language": "en", "tags": ["official"], "parts": [{ "url": "https://www.twitch.tv/videos/2686043957", "name": "VOD", "duration": "03:54:08-04:38:11" }] }]
                },
                {
                    "slug": "map2",
                    "map": "anc",
                    "result": "13:1",
                    "url": "https://www.challengermode.com/s/JBProLeague/games/4832d50d-3931-43e3-f2f2-08de6174dbff",
                    "streams": [{ "caster": "Affinity", "language": "en", "tags": ["official"], "parts": [{ "url": "https://www.twitch.tv/videos/2686043957", "name": "VOD", "duration": "04:47:28-05:12:30" }] }]
                }
            ]
        },
        {
            "slug": "match31",
            "bracket": ["Final", "Match 1"],
            "date": "2026-02-01",
            "matchup": { "team1": "lhc", "team2": "Fingers Crossed Fe" },
            "maps": [
                {
                    "slug": "map1",
                    "map": "anc",
                    "result": "4:13",
                    "url": "https://www.challengermode.com/s/JBProLeague/games/cc437516-3c05-4895-f763-08de6174dbff",
                    "streams": [{ "caster": "Fabbelit0", "language": "en", "tags": ["official"], "parts": [{ "url": "https://www.twitch.tv/videos/2686313152", "name": "VOD", "duration": "00:46:12-01:20:02" }] }]
                },
                {
                    "slug": "map2",
                    "map": "mrg",
                    "result": "6:13",
                    "url": "https://www.challengermode.com/s/JBProLeague/games/1d0dd259-cfec-4957-f872-08de6174dbff",
                    "streams": [{ "caster": "Fabbelit0", "language": "en", "tags": ["official"], "parts": [{ "url": "https://www.twitch.tv/videos/2686313152", "name": "VOD", "duration": "01:24:17-02:02:11" }] }]
                }
            ]
        }
    ]
}
